{
  "$schema": "./media.manifest.schema.json",
  "versao": 1,
  "atualizadoEm": "2026-10-12",
  "musgoOficial": {
    "hex": "#52543F",
    "fonte": "marca/logo-b-2048.jpg",
    "metodo": "média dos 4 cantos 300×300 px e da moldura de 200 px do logo (2000×2000); os 4 cantos deram #52543F idênticos"
  },
  "itens": [
    {
      "id": "retrato-bia-colete",
      "slug": "bia-retrato-colete",
      "arquivo": "imagens/retrato-bia-colete.jpg",
      "tipo": "imagem",
      "origem": "real",
      "autoria": "fotógrafo do ensaio: a informar",
      "consentimento": "titular",
      "publicavel": true,
      "previewOk": true,
      "dataRegistro": null,
      "pacienteRef": null,
      "menorDeIdade": false,
      "naoUsarComoCapa": false,
      "uso": ["hero.principal (janela grande da home)", "/bia"],
      "decisao": "usar",
      "tecnico": {
        "largura": 1500,
        "altura": 2000,
        "bytes": 204756,
        "formato": "JPEG q90 sRGB",
        "proporcao": "3:4",
        "sha256": "46ace2cfa974eed53c030b6c5dcfb6fb948ef1cc234de137f2725c0c49d264f6"
      },
      "corMedia": "#241F23",
      "corFundo": {
        "supEsq": "#0F0F12",
        "supDir": "#262430",
        "infEsq": "#18161C",
        "infDir": "#26252F",
        "leitura": "fundo escuro azulado frio"
      },
      "objectPosition": "40% 18%",
      "recortes": [
        {
          "nome": "3x4",
          "proporcao": "3:4",
          "objectPosition": "40% 18%"
        }
      ],
      "ajusteCorPlanejado": "ajuste GLOBAL de curva/temperatura, idêntico nos dois retratos, para aproximar o fundo frio do Tinta quente (#1E211A); aplicado só no derivado, nunca no original, nunca localizado em rosto ou pele; definir na sessão 3",
      "edicoes": [],
      "trim": [],
      "problemas": [
        "veio como anexo; pode ter sido recomprimido ou reduzido; pedir o original (recebido: 1500×2000, 204.756 bytes, JPEG q90, sem EXIF)",
        "crédito do fotógrafo a informar",
        "dataRegistro desconhecida (sem EXIF)"
      ]
    },
    {
      "id": "retrato-bia-vestido",
      "slug": "bia-retrato-vestido",
      "arquivo": "imagens/retrato-bia-vestido.jpg",
      "tipo": "imagem",
      "origem": "real",
      "autoria": "fotógrafo do ensaio: a informar",
      "consentimento": "titular",
      "publicavel": true,
      "previewOk": true,
      "dataRegistro": null,
      "pacienteRef": null,
      "menorDeIdade": false,
      "naoUsarComoCapa": false,
      "uso": ["home: seção \"A Bia\" (janela alta, corpo inteiro)", "/bia"],
      "decisao": "usar",
      "tecnico": {
        "largura": 1500,
        "altura": 2000,
        "bytes": 110394,
        "formato": "JPEG q90 sRGB",
        "proporcao": "3:4",
        "sha256": "d3c4aed607cff5c8099003ef066e865c98dacc9928d8237226f3c3a751167abf"
      },
      "corMedia": "#282525",
      "corFundo": {
        "supEsq": "#171718",
        "supDir": "#403E3F",
        "infEsq": "#403A35",
        "infDir": "#5F5752",
        "leitura": "degradê cinza, mais claro embaixo à direita"
      },
      "objectPosition": "50% 10%",
      "recortes": [
        {
          "nome": "3x4",
          "proporcao": "3:4",
          "objectPosition": "50% 10%"
        }
      ],
      "ajusteCorPlanejado": "mesmo ajuste GLOBAL do retrato-bia-colete (idêntico), só no derivado",
      "edicoes": [],
      "trim": [],
      "problemas": [
        "veio como anexo; pode ter sido recomprimido ou reduzido; pedir o original (recebido: 1500×2000, 110.394 bytes, JPEG q90, sem EXIF)",
        "rosto no topo (≈12% da altura): object-position nunca pode cortar o rosto em janelas largas",
        "crédito do fotógrafo a informar"
      ]
    },
    {
      "id": "logo-b-2048",
      "slug": "logo-b",
      "arquivo": "marca/logo-b-2048.jpg",
      "tipo": "marca",
      "origem": "real",
      "autoria": "marca da Clínica Espaço B (autoria do desenho a informar)",
      "consentimento": "titular",
      "publicavel": true,
      "previewOk": true,
      "dataRegistro": null,
      "pacienteRef": null,
      "menorDeIdade": false,
      "naoUsarComoCapa": false,
      "uso": ["extração das contraformas (sessão 3)", "favicon"],
      "decisao": "usar",
      "tecnico": {
        "largura": 2000,
        "altura": 2000,
        "bytes": 107818,
        "formato": "JPEG q90 sRGB (raster)",
        "proporcao": "1:1",
        "sha256": "df318d1faf409999d7eb5f9ef79678ce37b0c331bbcbf678a8fe36f1c4a71851"
      },
      "corMedia": "#5B5D49",
      "corFundo": {
        "medido": "#52543F",
        "letra": "#F4EFE6",
        "leitura": "fundo = Musgo oficial; letra creme (média dos pixels com luminância > 220)"
      },
      "edicoes": [],
      "trim": [],
      "problemas": [
        "veio como anexo; pode ter sido recomprimido ou reduzido; pedir o original (recebido: 2000×2000, não 2048×2048; 107.818 bytes, JPEG q90)",
        "é raster, não vetor; o vetor oficial, se vier, substitui este arquivo"
      ]
    },
    {
      "id": "foto-dra",
      "slug": "bia-print-antigo",
      "arquivo": "imagens/foto-dra.png",
      "tipo": "imagem",
      "origem": "real",
      "autoria": "a informar (print de rede social)",
      "consentimento": "titular",
      "publicavel": false,
      "previewOk": false,
      "substituida": true,
      "substituidaPor": ["retrato-bia-colete", "retrato-bia-vestido"],
      "dataRegistro": null,
      "pacienteRef": null,
      "menorDeIdade": false,
      "naoUsarComoCapa": false,
      "uso": [],
      "decisao": "não usar",
      "tecnico": {
        "largura": 678,
        "altura": 900,
        "bytes": 128664,
        "formato": "PNG",
        "sha256": "ff4ae98a43da3745d649aa65b334db1ecd91d219508bf9ea2458c82477301a1e"
      },
      "corMedia": "#282525",
      "edicoes": [],
      "trim": [],
      "problemas": ["print 678×900 com ícone do Instagram; substituído pelos retratos de estúdio"]
    },
    {
      "id": "logo-150",
      "slug": "logo-pequeno-antigo",
      "arquivo": "imagens/logo.jpg",
      "tipo": "marca",
      "origem": "real",
      "autoria": "marca da Clínica Espaço B",
      "consentimento": "titular",
      "publicavel": false,
      "previewOk": false,
      "substituida": true,
      "substituidaPor": ["logo-b-2048"],
      "dataRegistro": null,
      "pacienteRef": null,
      "menorDeIdade": false,
      "naoUsarComoCapa": false,
      "uso": [],
      "decisao": "não usar",
      "tecnico": {
        "largura": 150,
        "altura": 150,
        "bytes": 1923,
        "formato": "JPEG q61",
        "sha256": "d9cbba473f2e71d9d6bef56fb9b971e42e20515e77a2b47e2bf6b36d94763fb1"
      },
      "corMedia": "#585B4B",
      "edicoes": [],
      "trim": [],
      "problemas": ["150×150, baixa qualidade; substituído pelo logo-b-2048"]
    },
    {
      "id": "imagem1",
      "slug": "textura-linho-musgo",
      "arquivo": "imagens/imagem1.jpeg",
      "tipo": "imagem",
      "origem": "gerada-por-ia",
      "autoria": "gerada por IA (Gemini/Nano Banana)",
      "consentimento": "nenhum-necessario",
      "publicavel": true,
      "previewOk": true,
      "dataRegistro": null,
      "pacienteRef": null,
      "menorDeIdade": false,
      "naoUsarComoCapa": false,
      "uso": ["fundo escuro", "entrada"],
      "decisao": "usar como atmosfera",
      "tecnico": {
        "largura": 2752,
        "altura": 1536,
        "bytes": 2990222,
        "formato": "JPEG q100",
        "sha256": "450b5b669aec30ba116c91efbe99a5124ee561e9553835e7aee3a2e3e76fd882"
      },
      "corMedia": "#373821",
      "ajusteCorPlanejado": "aproximar do Musgo (#52543F) no derivado (sessão 3)",
      "edicoes": [],
      "trim": [],
      "problemas": [
        "tom diverge do Musgo: média #373821 (mais escura e mais amarela que #52543F); planejar ajuste de cor no build"
      ]
    },
    {
      "id": "imagem2",
      "slug": "textura-gesso-ripas",
      "arquivo": "imagens/imagem2.jpeg",
      "tipo": "imagem",
      "origem": "gerada-por-ia",
      "autoria": "gerada por IA (Gemini/Nano Banana)",
      "consentimento": "nenhum-necessario",
      "publicavel": true,
      "previewOk": true,
      "dataRegistro": null,
      "pacienteRef": null,
      "menorDeIdade": false,
      "naoUsarComoCapa": false,
      "uso": ["fundos claros", "manifesto"],
      "decisao": "usar como atmosfera",
      "tecnico": {
        "largura": 2752,
        "altura": 1536,
        "bytes": 3009340,
        "formato": "JPEG q100",
        "sha256": "a4ab6dff2ff9a1272eb740b1d3b7e22693442d0cb113bf1a4ee9ad897420f4db"
      },
      "corMedia": "#BEAD92",
      "edicoes": [],
      "trim": [],
      "problemas": []
    },
    {
      "id": "imagem3",
      "slug": "textura-flores-secas",
      "arquivo": "imagens/imagem3.jpeg",
      "tipo": "imagem",
      "origem": "gerada-por-ia",
      "autoria": "gerada por IA (Gemini/Nano Banana)",
      "consentimento": "nenhum-necessario",
      "publicavel": true,
      "previewOk": true,
      "dataRegistro": null,
      "pacienteRef": null,
      "menorDeIdade": false,
      "naoUsarComoCapa": false,
      "uso": ["textura"],
      "decisao": "usar como atmosfera (provisória)",
      "tecnico": {
        "largura": 1856,
        "altura": 2304,
        "bytes": 2846753,
        "formato": "JPEG q100",
        "sha256": "c002c7ee721e399fb9517617c2cdebb080fcedab22a2387144609332120027ca"
      },
      "corMedia": "#BCA890",
      "edicoes": [],
      "trim": [],
      "problemas": [
        "flores rosa-poeira; as flores reais da clínica são framboesa: priorizar foto real quando existir"
      ]
    },
    {
      "id": "imagem4",
      "slug": "textura-frascos-ambar",
      "arquivo": "imagens/imagem4.jpeg",
      "tipo": "imagem",
      "origem": "gerada-por-ia",
      "autoria": "gerada por IA (Gemini/Nano Banana)",
      "consentimento": "nenhum-necessario",
      "publicavel": true,
      "previewOk": true,
      "prioridade": "baixa",
      "dataRegistro": null,